{"C0_usr":0.49135072057990814,"C1_usr":0.05957647331103341,"ambient_mesh":"reference-shadow","boundary_beta":1,"build_hash":"sha256:95365db723aca620be767d2bde29de9a1e392955f61456d892261730eca2be0d","c_H":0.5,"case":"S","ell0":2,"ell_max":6,"git_commit":"3ed802b82c788159d4bfe0c090eed008ff3a6cc2","initial_coarse_level":5,"kernel_riesz_solver":"saddle_point","manuscript_sha256":"03d83e0eb7128aa5ef00002c6dac110f548351e52e92e56d7adf709880854d20","method":"PALOD","patch_solver_kind":"direct_saddle","petrov_mode":"two_sided","plateau_diagnostic":{"maximum_relative_oscillation":0.15,"minimum_geometric_mean_ratio":0.9,"window_steps":2},"practical_stop_tolerance":0.01,"quadrature":{"base_triangle_order":7,"gaussian_triangle_order":10,"max_recursive_subdivisions":4,"singular_triangle_order":10},"reference_adequacy":{"enabled":false,"maximum_terminal_error_fraction":0.25,"refinement_levels":1},"reference_epoch":0,"reference_level":10,"reference_mesh":"uniform-nvb","reference_refresh_H_steps":[3,6,9],"relative_energy_targets":[0.1,0.05,0.02,0.01],"repeat_index":0,"rho_star":0.25,"schema_version":4,"theta_H":0.5,"theta_loc":0.1998593454716038,"timing_repeats":1,"tolerances":{"eigen_relative_residual":1e-10,"interpolation_right_inverse":1e-09,"linear_relative_residual":1e-10,"prolongation_composition":1e-10},"trajectory_policy":"fixed_work_horizon","wavenumber":16,"work_limits":{"maximum_H_steps":12,"maximum_ambient_elements":4000000,"maximum_coarse_elements":300000,"maximum_iterations":260,"maximum_unknowns":4000000,"maximum_wall_seconds":43200}}
