{
  "C0_usr": 0.49135072057990814,
  "C1_usr": 0.059576473311033412,
  "ambient_mesh": "reference-shadow",
  "boundary_beta": 1,
  "build_hash": "comparison-S-k16-3epoch",
  "c_H": 0.5,
  "case": "S",
  "ell0": 2,
  "ell_max": 6,
  "git_commit": "9caf08b71feda1b1798756018091c8514d66f093",
  "initial_coarse_level": 5,
  "kernel_riesz_solver": "saddle_point",
  "manuscript_sha256": "03d83e0eb7128aa5ef00002c6dac110f548351e52e92e56d7adf709880854d20",
  "method": "PALOD",
  "patch_solver_kind": "direct_saddle",
  "petrov_mode": "two_sided",
  "plateau_diagnostic": {
    "maximum_relative_oscillation": 0.15,
    "minimum_geometric_mean_ratio": 0.9,
    "window_steps": 2
  },
  "practical_stop_tolerance": 0.01,
  "quadrature": {
    "base_triangle_order": 7,
    "gaussian_triangle_order": 10,
    "max_recursive_subdivisions": 4,
    "singular_triangle_order": 10
  },
  "reference_adequacy": {
    "enabled": false,
    "maximum_terminal_error_fraction": 0.25,
    "refinement_levels": 1
  },
  "reference_epoch": 0,
  "reference_refresh_H_steps": [3, 6],
  "reference_level": 10,
  "reference_mesh": "uniform-nvb",
  "relative_energy_targets": [0.1, 0.05, 0.02, 0.01],
  "repeat_index": 0,
  "rho_star": 0.25,
  "schema_version": 4,
  "theta_H": 0.5,
  "theta_loc": 0.19985934547160381,
  "timing_repeats": 1,
  "tolerances": {
    "eigen_relative_residual": 1e-10,
    "interpolation_right_inverse": 1e-9,
    "linear_relative_residual": 1e-10,
    "prolongation_composition": 1e-10
  },
  "trajectory_policy": "fixed_work_horizon",
  "wavenumber": 16,
  "work_limits": {
    "maximum_H_steps": 8,
    "maximum_ambient_elements": 2000000,
    "maximum_coarse_elements": 100000,
    "maximum_iterations": 180,
    "maximum_unknowns": 2000000,
    "maximum_wall_seconds": 7200
  }
}
